date,pollster,commissioner,method,sample,moe,undecided,source,note,ND,ELAS,PASOK,ELPIDA,EL,KKE,PE,FL,SAM
2026-06-06,Marc,,τηλεφωνική,,,,iefimerida.gr,"ΝΔ/ΕΛΑΣ/Ελπίδα από πηγή· λοιπά εκτίμηση",26.7,14.0,9.5,9.5,6.5,6.0,6.0,3.4,0
2026-06-04,Metron Analysis,,μικτή,,,13.1,ethnos.gr/dnews,"ΝΔ/ΕΛΑΣ/ΠΑΣΟΚ/Ελπίδα/ΠΕ/ΕΛ/ΚΚΕ από πηγή (πρόθεση ψήφου)· ΦΛ εκτίμηση",22.7,12.1,9.0,8.3,4.8,4.7,5.4,3.3,0
2026-06-02,GPO,,τηλεφωνική,,,,skai.gr,"ΝΔ/Ελπίδα από πηγή (εκτίμηση)· λοιπά εκτίμηση",25.0,13.0,11.0,10.5,7.0,6.0,6.0,3.4,0
2026-05-29,Opinion Poll,Action24,μικτή,,,,tribune.gr,"ΝΔ από πηγή· σειρά κομμάτων από πηγή· τιμές εκτίμηση",25.6,13.5,10.0,11.0,6.8,6.2,6.0,3.4,0
2026-05-05,—,,,,,,,"ενδεικτικό (βάθος γραφήματος τάσης)",27.0,13.0,11.5,9.0,7.2,6.6,6.4,3.4,0
2026-04-10,—,,,,,,,"ενδεικτικό (βάθος γραφήματος τάσης)",28.0,12.0,12.0,8.0,7.4,6.8,6.6,3.3,0
